{
  "name": "validate_closure_packet",
  "description": "Validate a machine-checkable closure packet line",
  "input_schema": {
    "type": "object",
    "properties": {
      "packet": {
        "type": "string",
        "description": "ClosurePacket line to validate (format: ClosurePacket: RoundID=<id>; ScopeID=<id>; ChecksTotal=<int>; ChecksPassed=<int>; ChecksFailed=<int>; Verdict=<PASS|BLOCK>; [OpenRisks=<text>]; [NextAction=<text>])"
      },
      "require_open_risks_when_block": {
        "type": "boolean",
        "description": "Require non-empty OpenRisks if Verdict=BLOCK (optional, default false)"
      },
      "require_next_action_when_block": {
        "type": "boolean",
        "description": "Require non-empty NextAction if Verdict=BLOCK (optional, default false)"
      }
    },
    "required": ["packet"]
  },
  "output_schema": {
    "type": "object",
    "properties": {
      "valid": {
        "type": "boolean",
        "description": "Whether packet is valid"
      },
      "output": {
        "type": "string",
        "description": "Validator output (VALID or INVALID: <error>)"
      },
      "exit_code": {
        "type": "integer",
        "description": "Exit code (0 for valid, 1 for invalid)"
      }
    },
    "required": ["valid", "output", "exit_code"]
  },
  "declared_capabilities": [
    "validate_closure_packet",
    "parse_packet_format",
    "check_packet_structure"
  ]
}
